Rank,Brand,CPU Brand,Processor Type,RAM,Storage,Screen Size,Resolution,Price,Product Name
1,HP,AMD,AMD Ryzen 5 7520U,16GB RAM,512GB SSD,15.6 inch,1920x1080,49999,Ordinateur portable HP 15-fc0132nf
2,HP,Intel,Intel Core i5 1334U,16GB RAM,512GB SSD,17.3 inch,1920x1080,59999,Ordinateur portable HP 17-cn3039nf
3,HP,AMD,AMD Ryzen 5 7520U,16GB RAM,512GB SSD,14 inch,1920x1080,49999,Ordinateur portable HP 14-em0042nf
4,HP,Intel,Intel Core i7 1355U,16GB RAM,512GB SSD,15.6 inch,1920x1080,62999,Ordinateur portable HP 15-fd0112nf
5,Macbook,Apple,Apple M2 8 CPU,16GB RAM,256GB SSD,13.6 inch,2560x1664,7990,Ordinateur Apple MACBOOK Air 13' M2 16Go CPU8 GPU8 256Go Minuit
6,ASUS,Intel,Intel Core 7 240H,32GB RAM,1TB SSD,16 inch,1920x1200,129999,PC Gamer ASUS C3607VM-RP056W
7,Lenovo,Intel,Intel Core Ultra 5 226V,16GB RAM,512GB SSD,14 inch,1920x1200,82999,Ordinateur portable LENOVO Yoga Slim 7 14ILL10 U5 Aura OLED Copilot+PC
8,ASUS,Intel,Intel Core i7 1355U,24GB RAM,1TB SSD,17 inch,1920x1080,89999,Ordinateur portable ASUS X1704VA-AU851W
9,ACER,AMD,AMD Ryzen AI 7 350,16GB RAM,1TB SSD,14 inch,1920x1200,79999,Ordinateur portable ACER Aspire A14-61M-R74Y Copilot +
10,Lenovo,AMD,AMD Ryzen 5 5500U,8GB RAM,512GB SSD,14 inch,1920x1200,59999,PC Hybride LENOVO IdeaPad Flex 5 14ALC7
11,ACER,Intel,Intel Core i3 N355,8GB RAM,512GB SSD,15 inch,1920x1080,39999,Ordinateur portable ACER Aspire AG15-32P-32EJ
12,Skillkorp,Intel,Intel Core 5 210H,16GB RAM,512GB SSD,16 inch,1920x1200,79999,PC Gamer SKILLKORP PRV3607VU-RP292W
13,HP,Intel,Intel Core Ultra 7 155H,16GB RAM,512GB SSD,14 inch,2880x1800,119999,PC Gamer HP Omen Transcend 14-fb0162nf
14,HP,AMD,AMD Ryzen AI 5 340,16GB RAM,512GB SSD,15.6 inch,1920x1080,139999,PC Gamer HP VICTUS 15-fb3003nf Copilot+
15,Lenovo,Snapdragon,Snapdragon X1 SE 26 100,16GB RAM,512GB SSD,15.3 inch,1920x1200,54999,Ordinateur portable LENOVO IdeaPad Slim 3 x 15Q8X10 AI Copilot+PC
16,Samsung,Intel,Intel Core Ultra 7 256V,16GB RAM,512GB SSD,14 inch,2880x1800,159999,Ordinateur portable SAMSUNG Galaxy Book5 Pro 14'' Copilot+ PC Gris
17,HP,Snapdragon,Snapdragon X Plus X1P 42 100,32GB RAM,512GB SSD,14 inch,1920x1200,99999,Ordinateur portable HP OmniBook 5 14-he0011nf OLED
18,ASUS,Intel,Intel Core I5 13420H,16GB RAM,512GB SSD,16 inch,1920x1200,69999,Ordinateur portable ASUS X1605VA-SH2054W
19,ASUS,Snapdragon,Snapdragon X Plus X1P 42 100,32GB RAM,1TB SSD,14 inch,1920x1200,109999,Ordinateur portable ASUS Zenbook UX3407QA-QD437W
20,HP,Intel,Intel Core 7 240H,32GB RAM,1TB SSD,16 inch,1920x1200,159999,PC Gamer HP OMEN 16-am0000nf
21,ASUS,AMD,AMD Ryzen AI 7 350,32GB RAM,1TB SSD,16 inch,1920x1200,109999,Ordinateur portable ASUS M5606KA-SH148W
22,Skillkorp,Intel,Intel Core 7 240H,32GB RAM,512GB SSD,16 inch,1920x1200,104999,PC Gamer SKILLKORP PRV3607VU-RP293W
23,Macbook,Apple,Apple M4 10 CPU,16GB RAM,256GB SSD,13.6 inch,2560x1664,11990,Ordinateur Apple MACBOOK Air 13' M4 CPU10 GPU8 16Go 256Go Minuit
24,HP,Intel,Intel Core i5 1334U,16GB RAM,512GB SSD,17.3 inch,1920x1080,69999,Ordinateur portable HP 17-cn3029nf
25,ACER,AMD,AMD Ryzen 7 260,32GB RAM,1TB,17.3 inch,1920x1080,179999,PC Gamer ACER Acer Nitro V 17 AI ANV17-41-R4W3
26,Lenovo,Intel,Intel Core i7 13620H,16GB RAM,512GB SSD,14 inch,1920x1200,89999,Ordinateur portable LENOVO IdeaPad Slim 3 14IRH10
27,HP,AMD,AMD Ryzen 7 5825U,16GB RAM,512GB SSD,15.6 inch,1920x1080,54999,Ordinateur portable HP 15-fc0139nf
28,Lenovo,AMD,AMD Ryzen 7 5825U,16GB RAM,512GB SSD,17.3 inch,1600x900,59899,Ordinateur portable LENOVO IdeaPad 3 17ABA7 R7
29,ASUS,AMD,AMD Ryzen 9 8940HX,32GB RAM,1TB SSD,16 inch,1920x1200,179999,PC Gamer ASUS A16-TUF608PM-RV060W
30,ASUS,AMD,AMD Ryzen 7 260,16GB RAM,512GB SSD,18 inch,1920x1200,129999,PC Gamer ASUS A18-TUF808UH-S8062W
31,Macbook,Apple,Apple M4 10 CPU,16GB RAM,512GB SSD,14.2 inch,3024x1964,18990,Ordinateur Apple MACBOOK Pro 14' M4 16Go CPU10 GPU10 512Go Noir
32,Lenovo,AMD,AMD Ryzen 5 7520U,8GB RAM,512GB SSD,14 inch,1920x1080,42999,Ordinateur portable LENOVO IdeaPad Slim 3 14AMN8
33,Thomson,Intel,Intel Core i3 10110U,8GB RAM,256GB SSD,15.6 inch,1920x1080,2990,Ordinateur portable THOMSON N15 i3/8/256
34,ASUS,Intel,Intel Core 5 120U,16GB RAM,512GB SSD,15 inch,1920x1080,59999,Ordinateur portable ASUS X1504VA-BQ3627W
35,Packard bell,Intel,Intel Celeron N4500,4GB RAM,128GB,14 inch,1920x1080,26999,Ordinateur portable PACKARD BELL B114-33-C3N8 + Office 365 p
36,Lenovo,AMD,AMD Ryzen 7 5825U,16GB RAM,512GB SSD,15.6 inch,1920x1080,54999,Ordinateur portable LENOVO IdeaPad Slim 3 15ABR8
37,ASUS,AMD,AMD Ryzen AI 9 HX 370,32GB RAM,1TB SSD,14 inch,2880x1800,219999,PC Gamer ASUS ZEPHYRUS-GA403WM-Q50W
38,ASUS,Intel,Intel Core i3 1315U,8GB RAM,128GB,14 inch,1920x1080,39999,Chromebook Plus ASUS Pack CX3402CVA-MW0512
39,Macbook,Apple,Apple M4 10 CPU,16GB RAM,256GB SSD,13.6 inch,2560x1664,10990,Ordinateur Apple MACBOOK Air 13' M4 CPU10 GPU8 16Go 256Go Argent
40,ASUS,AMD,AMD Ryzen 7 260,32GB RAM,1TB SSD,18.4 inch,1920x1200,109999,Ordinateur portable ASUS Vivobook S1807HA-S8022W
41,Lenovo,AMD,AMD Ryzen AI 7 350,16GB RAM,512GB SSD,14 inch,1920x1200,119999,Ordinateur portable LENOVO Yoga 7 2-in1 14AKP10 OLED Copilot+PC
42,Macbook,Apple,Apple M4 10 CPU,16GB RAM,256GB SSD,13.6 inch,2560x1664,10990,Ordinateur Apple MACBOOK Air 13' M4 CPU10 GPU8 16Go 256Go Bleu C
43,Macbook,Apple,Apple M4 10 CPU,16GB RAM,256GB SSD,15.3 inch,2880x1864,13990,Ordinateur Apple MACBOOK Air 15' M4 CPU10 GPU10 16Go 256Go Lumière
44,ASUS,Intel,Intel Core i9 14900HX,32GB RAM,1TB SSD,18 inch,2560x1600,199999,PC Gamer ASUS ROG Strix G18 G814JIR-N6082W
45,MSI,Intel,Intel Core 7 240H,16GB RAM,1TB SSD,17.3 inch,1920x1080,159999,PC Gamer MSI Cyborg 17 B2RWFKG-010FR
46,MSI,Intel,Intel Core 7 240H,16GB RAM,1TB SSD,17 inch,1920x1080,169999,PC Gamer MSI VenturePro 17 A2RWFG-042FR
47,ASUS,Intel,Intel Core Ultra 9 275HX,64GB RAM,1TB SSD,18 inch,2560x1600,459999,PC Gamer ASUS ROG SCAR18-G835LW-DRSA137W
48,ACER,AMD,AMD Ryzen 7 5825U,32GB RAM,1TB SSD,15.6 inch,1920x1080,79999,Ordinateur portable ACER Aspire AG15-42P-R5C9
49,Samsung,Intel,Intel Core i5 1335U,16GB RAM,256GB SSD,15.6 inch,1920x1080,59999,Ordinateur portable SAMSUNG Galaxy Book4 15.6' I5 16Go 256Go
50,ASUS,Intel,Intel Core Ultra 7 258V,32GB RAM,1TB SSD,16 inch,2880x1800,169999,Ordinateur portable ASUS Vivobook TP3607SA-RJ010W Copilot+
51,MSI,Intel,Intel Core Ultra 9 275HX,96GB RAM,1TB SSD,17 inch,2560x1600,429999,PC Gamer MSI Vector 17 HX AI A2XWJG-008FR
52,HP,Intel,Intel Core i7 1355U,16GB RAM,512GB SSD,17.3 inch,1920x1080,79999,Ordinateur portable HP 17-cn3025nf
53,ASUS,AMD,AMD Ryzen AI 7 350,16GB RAM,512GB SSD,14 inch,1920x1200,89999,Ordinateur portable ASUS M3407KA-SF005W
54,ASUS,AMD,AMD Ryzen 9 8940HX,32GB RAM,1TB SSD,18 inch,2560x1600,279999,PC Gamer ASUS STRIX-G18-G814PP-S9031W
55,Lenovo,Intel,Intel Core Ultra 9 285H,64GB RAM,1TB SSD,16 inch,3200x2000,429999,Ordinateur portable LENOVO Yoga Pro 9 16IAH10 OLED Copilot+PC
56,Macbook,Apple,Apple M4 10 CPU,16GB RAM,256GB SSD,15.3 inch,2880x1864,14990,Ordinateur Apple MACBOOK Air 15' M4 CPU10 GPU10 16Go 256Go Minuit
57,Samsung,Intel,Intel Core Ultra 7 256V,16GB RAM,512GB SSD,16 inch,2880x1800,219997,Ordinateur portable SAMSUNG Galaxy Book5 Pro 360 Copilot+ PC Gris
58,MSI,Intel,Intel Core Ultra 9 285HX,64GB RAM,6TB SSD,18 inch,3840x2400,739999,PC Gamer MSI Titan 18 HX AI A2XWJG-608FR
59,Lenovo,AMD,AMD Ryzen 5 5625U,16GB RAM,512GB SSD,17.3 inch,1600x900,54999,Ordinateur portable LENOVO IdeaPad 3 17ABA7 R5
60,Lenovo,AMD,AMD Ryzen AI 7 350,32GB RAM,512GB SSD,16 inch,1920x1200,99999,Ordinateur portable LENOVO IdeaPad Slim 5 16AKP10
61,ASUS,AMD,AMD Ryzen AI 9 HX 370,64GB RAM,1TB SSD,16 inch,3840x2400,279999,Ordinateur portable ASUS Pro Art H7606WI-ME171W Copilot+
62,Samsung,Intel,Intel Core Ultra 7 256V,16GB RAM,512GB SSD,15.6 inch,1920x1080,179999,Ordinateur portable SAMSUNG Galaxy Book5 360 15.6'' Copilot+ PC Gris
63,Samsung,Intel,Intel Core i7 1355U,16GB RAM,512GB SSD,15.6 inch,1920x1080,89999,Ordinateur portable SAMSUNG Galaxy Book 4 15.6' I7 16Go 512Go
64,Macbook,Apple,Apple M4 10 CPU,16GB RAM,256GB SSD,13.6 inch,2560x1664,11990,Ordinateur Apple MACBOOK Air 13' M4 CPU10 GPU8 16Go 256Go Lumière
65,LG,Intel,Intel Core i7 1360P,16GB RAM,512GB SSD,16 inch,2560x1600,99999,Ordinateur portable LG Gram 16Z90R-G.AA75F
66,MSI,Intel,Intel Core Ultra 9 285HX,64GB RAM,6TB SSD,18 inch,3840x2400,599999,PC Gamer MSI Titan 18 HX AI A2XWIG-606FR
67,Lenovo,Intel,Intel Core Ultra 9 275HX,32GB RAM,2TB SSD,16 inch,2560x1600,559999,PC Gamer LENOVO Legion Pro 7 16IAX10H
68,Macbook,Apple,Apple M4 10 CPU,16GB RAM,512GB SSD,13.6 inch,2560x1664,13490,Ordinateur Apple MACBOOK Air 13' M4 CPU10 GPU10 16Go 512Go Lumière
69,Dell,Intel,Intel Core i7,16GB RAM,1TB HDD,16 inch,3072x1920,169999,Ordinateur portable DELL Inspiron 16-7620 1To
70,Macbook,Apple,Apple M4 10 CPU,16GB RAM,256GB SSD,15.3 inch,2880x1864,13990,Ordinateur Apple MACBOOK Air 15' M4 CPU10 GPU10 16Go 256Go Bleu C
71,ASUS,Intel,Intel Core Ultra 9 275HX,64GB RAM,4TB SSD,18 inch,2560x1600,609999,PC Gamer ASUS ROG SCAR18-G835LX-DRSA082W
72,HP,Intel,Intel Core 7 240H,32GB RAM,1TB SSD,16 inch,2560x1600,169999,PC Gamer HP OMEN 16-am0058nf
73,MSI,Intel,Intel Core Ultra 9 275HX,32GB RAM,2TB SSD,18 inch,3840x2400,499999,PC Gamer MSI Stealth 18 HX AI A2XWIG-012FR
74,HP,Intel,Intel Core i5 1334U,16GB RAM,512GB SSD,16 inch,1920x1200,69999,Ordinateur portable HP Pavilion 16-af0038nf
75,ACER,Intel,Intel Core i7 13620H,16GB RAM,512GB SSD,15.6 inch,1920x1080,119999,PC Gamer ACER Nitro V 15 ANV15-52-71Q4
76,ASUS,AMD,AMD Ryzen AI 9 HX 370,32GB RAM,1TB SSD,16 inch,3200x2000,159999,Ordinateur portable ASUS Vivobook S16 S5606WA-MX091W Copilot+PC
77,ASUS,Intel,Intel Core Ultra 9 285HX,64GB RAM,2TB SSD,16 inch,2560x1600,559999,PC Gamer ASUS ROG Zephyrus-G16-GU605CX-DR4W
78,ASUS,Intel,Intel Core i7 11800H,16GB RAM,512GB SSD,17.3 inch,1920x1080,149999,PC Gamer ASUS F17-TUF766HE-HX008T
79,MSI,Intel,Intel Core Ultra 9 275HX,32GB RAM,1TB SSD,18 inch,2560x1600,39990,PC Gamer MSI Vector 18 HX AI A2XWIG-685FR
80,LG,Intel,Intel Core i7 1360P,16GB RAM,512GB SSD,17 inch,2560x1600,109999,Ordinateur portable LG Gram 17Z90R-G.AA75F
